{
  "code": "pt",
  "display_name": "Portugal",
  "region": "eu",
  "status": "research_required",
  "access_mode": "search_portal",
  "info_url": "https://irn.justica.gov.pt/",
  "notes": "No official bulk-download source is currently configured for this pipeline. Next step is to validate legal access terms and confirm an automatable bulk file or API endpoint before promotion to supported.",
  "all_systems_target": false,
  "research": {
    "pass_date": "2026-06-15",
    "basis": "BRIS registry table plus IRN portal review",
    "priority": "P2",
    "approach": "IRN portal confirms services and open statistics context but no explicit company API evidence in this pass",
    "next_action": "Identify whether registo.justica services include programmable endpoints"
  },
  "resources": [],
  "company_type_column": null,
  "registry": "country"
}