{
  "code": "edgar",
  "display_name": "SEC EDGAR",
  "region": "us",
  "status": "research_required",
  "access_mode": "search_portal",
  "info_url": "https://www.sec.gov/edgar/search/",
  "notes": "EDGAR onboarding is planned via DataMule rather than direct SEC integration. Treat this as a separate system until the DataMule acquisition path, dataset shape, and sharding rules are confirmed.",
  "all_systems_target": false,
  "research": {
    "pass_date": "2026-06-26",
    "basis": "SEC EDGAR public search and DataMule availability checks",
    "priority": "P2",
    "approach": "Confirm the DataMule delivery path for EDGAR filings, then define a deterministic acquisition format suitable for sharding and downstream company extraction.",
    "next_action": "Review DataMule documentation or service output for EDGAR filings and determine whether acquisition should use a direct dump, API-style fetch, or curated export.",
    "allow_research_runtime": true,
    "allowed_stages": ["acquire"]
  },
  "resources": [],
  "company_type_column": null,
  "registry": "system"
}