{
  "code": "gleif",
  "display_name": "GLEIF Global LEI Registry",
  "region": "global",
  "status": "live",
  "access_mode": "bulk_download",
  "info_url": "https://www.gleif.org/en/lei-data/access-and-use-lei-data",
  "notes": "GLEIF system profile for global LEI Level 1 concatenated files. Acquisition resolves the latest available concatenated file from GLEIF metadata before downloading the ZIP payload.",
  "all_systems_target": true,
  "supported_countries": null,
  "research": null,
  "resources": [
    {
      "name": "gleif_lei_cdf_concatenated",
      "url": "https://leidata.gleif.org/api/v1/concatenated-files/lei2",
      "file_format": "zip",
      "file_name": null,
      "extract": false,
      "file_name_template": "gleif-lei-cdf-{snapshot_date}.zip",
      "download_url_template": null,
      "notes": "GLEIF Level 1 LEI-CDF concatenated file (latest available).",
      "publication_frequency": "daily",
      "snapshot_date_mode": "run_date",
      "refresh_if_older_than_days": 90,
      "adapter": "gleif_latest_concatenated",
      "request_headers": [],
      "required_env_vars": [],
      "auth_header_name": null,
      "auth_header_env": null,
      "auth_header_prefix": null
    }
  ],
  "system_uri_identifier_candidates": [
    "LEI"
  ],
  "system_field_candidates": {
    "name": ["Entity_LegalName"],
    "company_number": ["Entity_RegistrationAuthority_RegistrationAuthorityEntityID"],
    "lei": ["LEI"],
    "company_type": ["Entity_EntityCategory"],
    "current_status": ["Entity_EntityStatus", "Registration_RegistrationStatus"],
    "incorporation_date": ["Entity_EntityCreationDate"]
  },
  "company_type_column": "Entity_EntityCategory",
  "name_variant_type_map": {
    "LEGAL_NAME": "primary",
    "PREVIOUS_LEGAL_NAME": "previous",
    "TRADING_OR_OPERATING_NAME": "trading",
    "ALTERNATIVE_LANGUAGE_LEGAL_NAME": "alternative_language",
    "PREFERRED_ASCII_TRANSLITERATED_LEGAL_NAME": "transliteration_preferred",
    "AUTO_ASCII_TRANSLITERATED_LEGAL_NAME": "transliteration_auto"
  },
  "primary_name_override_type_priority": [
    "transliteration_preferred",
    "transliteration_auto"
  ],
  "registry": "system"
}