{
  "code": "sk",
  "display_name": "Slovakia",
  "region": "eu",
  "status": "research_required",
  "access_mode": "search_portal",
  "info_url": "http://www.orsr.sk/Default.asp?lan=en",
  "notes": "No official bulk-download source is currently configured for this pipeline. Next step is to validate legal access terms and confirm an automatable bulk file or API endpoint before promotion to supported.",
  "all_systems_target": false,
  "research": {
    "pass_date": "2026-06-15",
    "basis": "BRIS registry table plus ORSR search review",
    "priority": "P2",
    "approach": "Public business register search and update timestamps are visible but no API mention",
    "next_action": "Look for ministry technical integration docs or official data export service"
  },
  "resources": [],
  "company_type_column": null,
  "registry": "country"
}