{
  "code": "hr",
  "display_name": "Croatia",
  "region": "eu",
  "status": "research_required",
  "access_mode": "search_portal",
  "info_url": "https://sudreg.pravosudje.hr/",
  "notes": "No official bulk-download source is currently configured for this pipeline. Next step is to validate legal access terms and confirm an automatable bulk file or API endpoint before promotion to supported.",
  "all_systems_target": false,
  "research": {
    "pass_date": "2026-06-15",
    "basis": "BRIS registry table plus court register page review",
    "priority": "P2",
    "approach": "Search portal and usage terms are confirmed but no explicit API or bulk channel found",
    "next_action": "Contact sudski.registar@pravosudje.hr for technical data access options"
  },
  "resources": [],
  "company_type_column": null,
  "registry": "country"
}