{
  "code": "si",
  "display_name": "Slovenia",
  "region": "eu",
  "status": "research_required",
  "access_mode": "search_portal",
  "info_url": "https://www.ajpes.si/prs/Default.asp?language=english",
  "notes": "No official bulk-download source is currently configured for this pipeline. Next step is to validate legal access terms and confirm an automatable bulk file or API endpoint before promotion to supported.",
  "all_systems_target": false,
  "research": {
    "pass_date": "2026-06-15",
    "basis": "BRIS registry table plus AJPES ePRS review",
    "priority": "P2",
    "approach": "ePRS search and terms are visible but API or bulk service is not explicit on this page",
    "next_action": "Review AJPES financial data and online registers sections for technical data services"
  },
  "resources": [],
  "company_type_column": null,
  "registry": "country"
}