{
  "code": "cz",
  "display_name": "Czech Republic",
  "region": "eu",
  "status": "research_required",
  "access_mode": "search_portal",
  "info_url": "https://or.justice.cz/ias/ui/rejstrik",
  "notes": "No official bulk-download source is currently configured for this pipeline. Next step is to validate legal access terms and confirm an automatable bulk file or API endpoint before promotion to supported.",
  "all_systems_target": false,
  "research": {
    "pass_date": "2026-06-15",
    "basis": "BRIS registry table plus public register page review",
    "priority": "P2",
    "approach": "Public register search and a new portal link are visible but API or bulk export is not explicit",
    "next_action": "Investigate the new verejnerejstriky portal for machine interfaces and terms"
  },
  "resources": [],
  "company_type_column": null,
  "registry": "country"
}