{
  "code": "ro",
  "display_name": "Romania",
  "region": "eu",
  "status": "research_required",
  "access_mode": "search_portal",
  "info_url": "https://www.onrc.ro/index.php/en",
  "notes": "No official bulk-download source is currently configured for this pipeline. Next step is to validate legal access terms and confirm an automatable bulk file or API endpoint before promotion to supported.",
  "all_systems_target": false,
  "research": {
    "pass_date": "2026-06-15",
    "basis": "BRIS registry table plus ONRC portal review",
    "priority": "P2",
    "approach": "ONRC confirms online portal services and InfoCert information products with qualified signature support",
    "next_action": "Clarify if InfoCert or portal channels provide machine API or bulk export access"
  },
  "resources": [],
  "company_type_column": null,
  "registry": "country"
}